{
  "season_id": "2026-07-17",
  "status": "published",
  "source": "document_reconstruction",
  "published_at": "2026-07-17T23:59:00+08:00",
  "ruleset": "legacy-guide-v1",
  "source_document": "docs/star-cup/2026-07-17-round3-betting-guide.md",
  "coverage": {
    "power": {
      "available": 64,
      "total": 64
    },
    "qualifier": {
      "available": 60,
      "total": 64
    },
    "history": {
      "available": 47,
      "total": 64
    }
  },
  "groups": [
    {
      "id": 1,
      "picks": [
        {
          "round": "R1",
          "slot": "A",
          "p1": {
            "name": "夜凜月",
            "player_id": null
          },
          "p2": {
            "name": "I매I인써하",
            "player_id": null
          },
          "selected_side": "p1",
          "confidence": "high",
          "basis": "legacy_guide",
          "reason": "上屆 10/10（滿時）vs I매I인써하僅 2/10，第一順位直接分出；戰力（12.01 vs 9.38）同向",
          "missing": [],
          "forced": false,
          "depends_on": []
        },
        {
          "round": "R1",
          "slot": "B",
          "p1": {
            "name": "Cashasy",
            "player_id": null
          },
          "p2": {
            "name": "LD丨팡대",
            "player_id": null
          },
          "selected_side": "p2",
          "confidence": "medium",
          "basis": "legacy_guide",
          "reason": "**上屆兩位組冠軍內戰**：上屆時間 01:27.01 vs Cashasy 01:27.64 視同打平 → 遞補比戰力，25.39M vs 22.11M 팡대勝出",
          "missing": [],
          "forced": false,
          "depends_on": []
        },
        {
          "round": "R1",
          "slot": "C",
          "p1": {
            "name": "吐司夾蛋",
            "player_id": null
          },
          "p2": {
            "name": "阿武花豆",
            "player_id": null
          },
          "selected_side": "p2",
          "confidence": "high",
          "basis": "legacy_guide",
          "reason": "上屆亞軍、10/10 04:20.83 vs 吐司夾蛋無上屆紀錄；戰力 19.57M vs 13.90M 同向",
          "missing": [],
          "forced": false,
          "depends_on": []
        },
        {
          "round": "R1",
          "slot": "D",
          "p1": {
            "name": "龍×이뮤",
            "player_id": null
          },
          "p2": {
            "name": "CoBe",
            "player_id": null
          },
          "selected_side": "p2",
          "confidence": "medium",
          "basis": "legacy_guide",
          "reason": "上屆同 10/10，07:39.58 vs 龍×이뮤 07:48.28 小勝；戰力（13.32 vs 12.99）同向但差距皆小",
          "missing": [],
          "forced": false,
          "depends_on": []
        },
        {
          "round": "R2",
          "slot": "upper",
          "p1": {
            "name": "夜凜月",
            "player_id": null
          },
          "p2": {
            "name": "阿武花豆",
            "player_id": null
          },
          "selected_side": "p2",
          "confidence": "high",
          "basis": "legacy_guide",
          "reason": "上屆 04:20.83 vs 夜凜月滿時通關，紀錄斷層；戰力亦大勝",
          "missing": [],
          "forced": false,
          "depends_on": [
            "A",
            "C"
          ]
        },
        {
          "round": "R2",
          "slot": "lower",
          "p1": {
            "name": "LD丨팡대",
            "player_id": null
          },
          "p2": {
            "name": "CoBe",
            "player_id": null
          },
          "selected_side": "p1",
          "confidence": "high",
          "basis": "legacy_guide",
          "reason": "上屆 01:27 級 vs CoBe 7 分台，紀錄斷層；戰力亦高一截",
          "missing": [],
          "forced": false,
          "depends_on": [
            "B",
            "D"
          ]
        },
        {
          "round": "決賽",
          "slot": "final",
          "p1": {
            "name": "阿武花豆",
            "player_id": null
          },
          "p2": {
            "name": "LD丨팡대",
            "player_id": null
          },
          "selected_side": "p2",
          "confidence": "high",
          "basis": "legacy_guide",
          "reason": "上屆 01:27.01 vs 阿武花豆 04:20.83；戰力 25.39M vs 19.57M 同向",
          "missing": [],
          "forced": false,
          "depends_on": [
            "upper",
            "lower"
          ]
        }
      ]
    },
    {
      "id": 2,
      "picks": [
        {
          "round": "R1",
          "slot": "A",
          "p1": {
            "name": "단별ll헌큔",
            "player_id": null
          },
          "p2": {
            "name": "김미태",
            "player_id": null
          },
          "selected_side": "p1",
          "confidence": "medium",
          "basis": "legacy_guide",
          "reason": "雙方皆無上屆紀錄 → 遞補比戰力：16.69M vs 김미태 8.12M 翻倍優勢；缺第一順位資料，信心上限 ⚖",
          "missing": [],
          "forced": false,
          "depends_on": []
        },
        {
          "round": "R1",
          "slot": "B",
          "p1": {
            "name": "SuperAaron",
            "player_id": null
          },
          "p2": {
            "name": "仔仔團奧奧",
            "player_id": null
          },
          "selected_side": "p1",
          "confidence": "medium",
          "basis": "legacy_guide",
          "reason": "上屆 10/10 04:55.26 vs 仔仔團奧奧 05:10.15 小勝，戰力（20.71 vs 16.91）同向；扣分項：上屆 R2 曾秒退",
          "missing": [],
          "forced": false,
          "depends_on": []
        },
        {
          "round": "R1",
          "slot": "C",
          "p1": {
            "name": "I매I똥꼬",
            "player_id": null
          },
          "p2": {
            "name": "LD丨말랭",
            "player_id": null
          },
          "selected_side": "p2",
          "confidence": "medium",
          "basis": "legacy_guide",
          "reason": "唯一有上屆紀錄者（10/10 滿時）；I매I똥꼬 ⚠ 身分不明、各欄無資料，戰力亦말랭領先",
          "missing": [],
          "forced": false,
          "depends_on": []
        },
        {
          "round": "R1",
          "slot": "D",
          "p1": {
            "name": "LD丨힝",
            "player_id": null
          },
          "p2": {
            "name": "劍人海拉",
            "player_id": null
          },
          "selected_side": "p2",
          "confidence": "medium",
          "basis": "legacy_guide",
          "reason": "**依標準押上屆冠軍**：劍人海拉＝上屆第3組冠軍、10/10 01:57.30，第一順位一面倒；LD丨힝 零上屆紀錄，戰力 2.5 倍（33.77M）與資格賽 #1（04:06.1）皆屬低順位，不得推翻冠軍紀錄——但反向訊號極強，僅 ⚖ 並列入風險",
          "missing": [],
          "forced": false,
          "depends_on": []
        },
        {
          "round": "R2",
          "slot": "upper",
          "p1": {
            "name": "단별ll헌큔",
            "player_id": null
          },
          "p2": {
            "name": "LD丨말랭",
            "player_id": null
          },
          "selected_side": "p2",
          "confidence": "low",
          "basis": "legacy_guide",
          "reason": "말랭有（滿時）通關紀錄、헌큔無紀錄，第一順位微弱領先；戰力打平（16.45 vs 16.69），依據薄弱",
          "missing": [],
          "forced": false,
          "depends_on": [
            "A",
            "C"
          ]
        },
        {
          "round": "R2",
          "slot": "lower",
          "p1": {
            "name": "SuperAaron",
            "player_id": null
          },
          "p2": {
            "name": "劍人海拉",
            "player_id": null
          },
          "selected_side": "p2",
          "confidence": "medium",
          "basis": "legacy_guide",
          "reason": "上屆 01:57.30 vs SuperAaron 04:55.26，紀錄大勝；戰力落後（13.54 vs 20.71）衝突，依第一順位押海拉",
          "missing": [],
          "forced": false,
          "depends_on": [
            "B",
            "D"
          ]
        },
        {
          "round": "決賽",
          "slot": "final",
          "p1": {
            "name": "LD丨말랭",
            "player_id": null
          },
          "p2": {
            "name": "劍人海拉",
            "player_id": null
          },
          "selected_side": "p2",
          "confidence": "high",
          "basis": "legacy_guide",
          "reason": "上屆 01:57 vs 말랭滿時通關，紀錄斷層；戰力小幅落後不足以翻案",
          "missing": [],
          "forced": false,
          "depends_on": [
            "upper",
            "lower"
          ]
        }
      ]
    },
    {
      "id": 3,
      "picks": [
        {
          "round": "R1",
          "slot": "A",
          "p1": {
            "name": "紅桃A",
            "player_id": null
          },
          "p2": {
            "name": "戰神冥海龍靈",
            "player_id": null
          },
          "selected_side": "p1",
          "confidence": "high",
          "basis": "legacy_guide",
          "reason": "上屆 10/10 02:11.36 vs 戰神冥海龍靈無紀錄；戰力（17.04 vs 11.97）同向",
          "missing": [],
          "forced": false,
          "depends_on": []
        },
        {
          "round": "R1",
          "slot": "B",
          "p1": {
            "name": "RV297",
            "player_id": null
          },
          "p2": {
            "name": "龍×냥코",
            "player_id": null
          },
          "selected_side": "p1",
          "confidence": "high",
          "basis": "legacy_guide",
          "reason": "上屆 10/10 03:12.98 vs 龍×냥코僅 4/10；戰力 26.12M vs 11.45M 斷層",
          "missing": [],
          "forced": false,
          "depends_on": []
        },
        {
          "round": "R1",
          "slot": "C",
          "p1": {
            "name": "龍×콰트",
            "player_id": null
          },
          "p2": {
            "name": "戰營養腦七拍",
            "player_id": null
          },
          "selected_side": "p1",
          "confidence": "medium",
          "basis": "legacy_guide",
          "reason": "有 10/10 紀錄（滿時）vs 戰營養腦七拍無紀錄；戰力（12.98 vs 11.31）同向但都不強",
          "missing": [],
          "forced": false,
          "depends_on": []
        },
        {
          "round": "R1",
          "slot": "D",
          "p1": {
            "name": "LD丨짱구",
            "player_id": null
          },
          "p2": {
            "name": "I매IFLEX3R",
            "player_id": null
          },
          "selected_side": "p1",
          "confidence": "medium",
          "basis": "legacy_guide",